{"$defs":{"actorReference":{"additionalProperties":false,"properties":{"actor_id":{"$ref":"#/$defs/idString"},"actor_type":{"enum":["HUMAN","AGENT","SERVICE","RUNTIME"],"type":"string"},"display_name":{"minLength":1,"type":"string"},"role":{"minLength":1,"type":"string"}},"required":["actor_id","actor_type","role"],"type":"object"},"authorityReference":{"additionalProperties":false,"properties":{"approval_reference":{"minLength":1,"type":"string"},"authority_id":{"$ref":"#/$defs/idString"},"authority_type":{"enum":["FOUNDER","FORMAL_DELEGATION","POLICY","DOMAIN_OWNER"],"type":"string"},"delegation_record":{"type":["string","null"]},"expires_at":{"format":"date-time","type":["string","null"]},"scope":{"items":{"minLength":1,"type":"string"},"minItems":1,"type":"array","uniqueItems":true}},"required":["authority_id","authority_type","scope","approval_reference"],"type":"object"},"gateResult":{"additionalProperties":false,"properties":{"evidence_event_ids":{"items":{"$ref":"#/$defs/idString"},"type":"array","uniqueItems":true},"notes":{"type":"string"},"status":{"enum":["PASS","FAIL","PENDING","NOT_APPLICABLE"],"type":"string"}},"required":["status","evidence_event_ids"],"type":"object"},"idString":{"pattern":"^[A-Z0-9][A-Z0-9._:/-]{2,}$","type":"string"},"kernelAdmissionOutcome":{"enum":["HOLD","CORRECTION_REQUIRED","PROVISIONAL","ADMITTED"],"type":"string"},"nonEmptyString":{"minLength":1,"type":"string"},"releaseState":{"enum":["RED","BLUE","GREEN"],"type":"string"},"semver":{"pattern":"^(0|[1-9]\\d*)\\.(0|[1-9]\\d*)\\.(0|[1-9]\\d*)(?:-[0-9A-Za-z.-]+)?(?:\\+[0-9A-Za-z.-]+)?$","type":"string"}},"$id":"urn:pfu:schema:release-verdict:1.0.0","$schema":"https://json-schema.org/draft/2020-12/schema","additionalProperties":false,"allOf":[{"if":{"properties":{"decision":{"const":"GREEN_READY"}},"required":["decision"]},"then":{"properties":{"blockers":{"maxItems":0},"gates":{"properties":{"authority":{"properties":{"status":{"const":"PASS"}}},"boundary":{"properties":{"status":{"const":"PASS"}}},"doctrine":{"properties":{"status":{"const":"PASS"}}},"identity":{"properties":{"status":{"const":"PASS"}}},"integrity":{"properties":{"status":{"const":"PASS"}}},"mutation":{"properties":{"status":{"const":"PASS"}}},"permission":{"properties":{"status":{"const":"PASS"}}},"verification":{"properties":{"status":{"const":"PASS"}}}}},"merge_readiness":{"const":"READY_FOR_FOUNDER_DECISION"}}}},{"if":{"properties":{"merge_authorization":{"const":"GRANTED"}},"required":["merge_authorization"]},"then":{"properties":{"decision":{"const":"GREEN_READY"},"gates":{"properties":{"founder_release":{"properties":{"status":{"const":"PASS"}}}}}}}},{"if":{"properties":{"deployment_authorization":{"const":"GRANTED"}},"required":["deployment_authorization"]},"then":{"properties":{"merge_authorization":{"const":"GRANTED"},"release_state":{"const":"GREEN"},"runtime_activation_authorization":{"const":"GRANTED"}}}}],"description":"Release and merge-readiness verdict that keeps PFU release state separate from kernel admission and explicit Founder authorization.","properties":{"authority":{"$ref":"#/$defs/authorityReference"},"blockers":{"items":{"$ref":"#/$defs/nonEmptyString"},"type":"array","uniqueItems":true},"decision":{"enum":["HOLD","CORRECTION_REQUIRED","GREEN_READY","REJECTED"],"type":"string"},"deployment_authorization":{"enum":["NOT_GRANTED","GRANTED"],"type":"string"},"domain_mutation_authorization":{"enum":["HOLD","GRANTED"],"type":"string"},"evaluated_at":{"format":"date-time","type":"string"},"evaluator":{"$ref":"#/$defs/actorReference"},"evidence_event_ids":{"items":{"$ref":"#/$defs/idString"},"minItems":1,"type":"array","uniqueItems":true},"expires_at":{"format":"date-time","type":["string","null"]},"gates":{"additionalProperties":false,"properties":{"authority":{"$ref":"#/$defs/gateResult"},"boundary":{"$ref":"#/$defs/gateResult"},"doctrine":{"$ref":"#/$defs/gateResult"},"founder_release":{"$ref":"#/$defs/gateResult"},"identity":{"$ref":"#/$defs/gateResult"},"integrity":{"$ref":"#/$defs/gateResult"},"mutation":{"$ref":"#/$defs/gateResult"},"permission":{"$ref":"#/$defs/gateResult"},"verification":{"$ref":"#/$defs/gateResult"}},"required":["identity","doctrine","authority","permission","boundary","integrity","mutation","verification","founder_release"],"type":"object"},"kernel_admission_outcome":{"$ref":"#/$defs/kernelAdmissionOutcome"},"merge_authorization":{"enum":["NOT_GRANTED","GRANTED"],"type":"string"},"merge_readiness":{"enum":["NOT_READY","READY_FOR_FOUNDER_DECISION"],"type":"string"},"notes":{"type":"string"},"release_state":{"$ref":"#/$defs/releaseState"},"runtime_activation_authorization":{"enum":["NOT_GRANTED","GRANTED"],"type":"string"},"target":{"additionalProperties":false,"properties":{"commit_sha":{"pattern":"^[a-f0-9]{40}$","type":"string"},"pull_request":{"minimum":1,"type":["integer","null"]},"target_id":{"$ref":"#/$defs/idString"},"target_type":{"enum":["KERNEL","DOMAIN","CAPABILITY","SYSTEM","RELEASE"],"type":"string"},"version":{"$ref":"#/$defs/semver"}},"required":["target_id","target_type","version","commit_sha","pull_request"],"type":"object"},"verdict_id":{"$ref":"#/$defs/idString"}},"required":["verdict_id","evaluated_at","target","evaluator","authority","evidence_event_ids","gates","kernel_admission_outcome","release_state","merge_readiness","merge_authorization","deployment_authorization","runtime_activation_authorization","domain_mutation_authorization","blockers","decision"],"title":"PFU Machine Layer — Release Verdict","type":"object"}
